{
  "slug": "freshwater-vs-saltwater-pearls-is-the-price-difference-worth-it",
  "frontmatter": {
    "title": "Freshwater vs. Saltwater Pearls: Is the Price Difference Worth It?",
    "excerpt": "Compare freshwater and saltwater pearls in the terms that matter most: look, luster, wearability, and value. Learn when saltwater pearls are worth the higher price.",
    "seoDescription": "Compare freshwater and saltwater pearls to see whether the price difference is worth it, with a focus on luster, wearability, and value.",
    "keywords": [
      "saltwater pearl",
      "freshwater pearls",
      "saltwater vs freshwater pearls",
      "pearl comparison",
      "pearl value"
    ],
    "ogImage": "/images/blog/freshwater-vs-saltwater-pearls.jpg",
    "ogImageAlt": "A refined pearl jewelry image comparing freshwater and saltwater pearl styles",
    "publishedAt": "2026-04-21",
    "updatedAt": "2026-04-21",
    "author": "33 Pearl Atelier",
    "tags": [
      "Pearls",
      "Comparison",
      "Buying Guide"
    ],
    "readingMinutes": 5
  },
  "bodyMarkdown": "## Why this comparison matters\n\nIf you are comparing freshwater and saltwater pearls, the real question is usually not just price. It is whether the difference in finish, luster, and overall presence is meaningful enough to justify spending more. That matters whether you are choosing a piece for everyday wear, a gift, or a more refined long-term purchase.\n\nThe answer is rarely one-size-fits-all. But if you care most about a pearl’s luminous appearance and polished feel, saltwater pearls often make the stronger case.\n\n## What typically separates freshwater and saltwater pearls\n\nAt a basic level, freshwater and saltwater pearls come from different environments, and that difference shows up in the finished look. Freshwater pearls are often appreciated for their accessibility and variety. Saltwater pearls are more often chosen for their more elevated, consistent appearance.\n\nFor most readers, the first things to compare are simple:\n\n- how bright and clean the pearl looks\n- how polished the surface appears\n- how refined the piece feels when worn\n- how much value you place on long-term visual impact\n\nThat is where the comparison becomes useful. Not every pearl needs to do the same job.\n\n## Why saltwater pearls are often the more refined choice\n\nSaltwater pearls are often preferred when the goal is a more luminous, understatedly elegant result. Their appeal is not just about appearance at first glance. It is about the way that appearance holds up in wear.\n\nFor many buyers, long-lasting luster is the detail that justifies the higher price. A pearl that keeps a clean, refined glow can feel more complete on the body and more versatile over time. That is especially true if you want a piece that reads as polished without needing to be dramatic.\n\nAt 33 Pearl Atelier, saltwater pearls are a natural focus for that reason. They suit a calm, modern approach to jewelry, where refined finish matters as much as first impression. If your priority is a pearl that feels especially considered in everyday wear or gifting, saltwater pearls are often the more convincing choice.\n\n## When freshwater pearls may make more sense\n\nFreshwater pearls can still be the better fit in some cases. If your main priority is keeping the purchase more accessible, or if you want a softer, more relaxed look, they can be an excellent option.\n\nThey may also make sense if you are buying a piece meant to feel easy and unfussy rather than especially polished. In that case, the higher price of saltwater pearls may not add enough value for what you want the jewelry to do.\n\n## How to decide which pearl type is worth it for you\n\nThe simplest way to decide is to separate budget from finish.\n\nChoose freshwater pearls if you want:\n\n- a more accessible entry point\n- a softer, more casual impression\n- a piece where price matters more than refinement\n\nChoose saltwater pearls if you want:\n\n- stronger emphasis on luminous luster\n- a more refined overall appearance\n- a piece that feels worth holding onto because of its finish\n\nIf you are asking whether the price difference is worth it, the real test is this: will you notice and value the extra polish every time you wear it? If the answer is yes, saltwater pearls usually justify the difference.\n\n## A refined starting point if you prefer saltwater pearls\n\nFor readers who want a pearl with lasting luster and a more polished feel, saltwater pearls are often the clearer choice. They do not have to be the louder option to be the more satisfying one.\n\nIf you are exploring that direction, look for pieces that keep the focus on finish, wearability, and restraint. That is often where saltwater pearls feel most compelling.",
  "internalLinks": [],
  "qa": {
    "primaryKeywordUsed": true,
    "relatedReadingSectionIncluded": false,
    "notes": [
      "Title, excerpt, and body align on the value-focused comparison angle.",
      "No unsupported pricing, sourcing, or gemological claims added.",
      "Brand preference for saltwater pearls is expressed as an editorial point of view."
    ]
  },
  "markdownDocument": "---\ntitle: \"Freshwater vs. Saltwater Pearls: Is the Price Difference Worth It?\"\nexcerpt: \"Compare freshwater and saltwater pearls in the terms that matter most: look, luster, wearability, and value. Learn when saltwater pearls are worth the higher price.\"\nseoDescription: \"Compare freshwater and saltwater pearls to see whether the price difference is worth it, with a focus on luster, wearability, and value.\"\nkeywords: [\"saltwater pearl\", \"freshwater pearls\", \"saltwater vs freshwater pearls\", \"pearl comparison\", \"pearl value\"]\nogImage: \"/images/blog/freshwater-vs-saltwater-pearls.jpg\"\nogImageAlt: \"A refined pearl jewelry image comparing freshwater and saltwater pearl styles\"\npublishedAt: \"2026-04-21\"\nupdatedAt: \"2026-04-21\"\nauthor: \"33 Pearl Atelier\"\ntags: [\"Pearls\", \"Comparison\", \"Buying Guide\"]\nreadingMinutes: 5\n---\n\n## Why this comparison matters\n\nIf you are comparing freshwater and saltwater pearls, the real question is usually not just price. It is whether the difference in finish, luster, and overall presence is meaningful enough to justify spending more. That matters whether you are choosing a piece for everyday wear, a gift, or a more refined long-term purchase.\n\nThe answer is rarely one-size-fits-all. But if you care most about a pearl’s luminous appearance and polished feel, saltwater pearls often make the stronger case.\n\n## What typically separates freshwater and saltwater pearls\n\nAt a basic level, freshwater and saltwater pearls come from different environments, and that difference shows up in the finished look. Freshwater pearls are often appreciated for their accessibility and variety. Saltwater pearls are more often chosen for their more elevated, consistent appearance.\n\nFor most readers, the first things to compare are simple:\n\n- how bright and clean the pearl looks\n- how polished the surface appears\n- how refined the piece feels when worn\n- how much value you place on long-term visual impact\n\nThat is where the comparison becomes useful. Not every pearl needs to do the same job.\n\n## Why saltwater pearls are often the more refined choice\n\nSaltwater pearls are often preferred when the goal is a more luminous, understatedly elegant result. Their appeal is not just about appearance at first glance. It is about the way that appearance holds up in wear.\n\nFor many buyers, long-lasting luster is the detail that justifies the higher price. A pearl that keeps a clean, refined glow can feel more complete on the body and more versatile over time. That is especially true if you want a piece that reads as polished without needing to be dramatic.\n\nAt 33 Pearl Atelier, saltwater pearls are a natural focus for that reason. They suit a calm, modern approach to jewelry, where refined finish matters as much as first impression. If your priority is a pearl that feels especially considered in everyday wear or gifting, saltwater pearls are often the more convincing choice.\n\n## When freshwater pearls may make more sense\n\nFreshwater pearls can still be the better fit in some cases. If your main priority is keeping the purchase more accessible, or if you want a softer, more relaxed look, they can be an excellent option.\n\nThey may also make sense if you are buying a piece meant to feel easy and unfussy rather than especially polished. In that case, the higher price of saltwater pearls may not add enough value for what you want the jewelry to do.\n\n## How to decide which pearl type is worth it for you\n\nThe simplest way to decide is to separate budget from finish.\n\nChoose freshwater pearls if you want:\n\n- a more accessible entry point\n- a softer, more casual impression\n- a piece where price matters more than refinement\n\nChoose saltwater pearls if you want:\n\n- stronger emphasis on luminous luster\n- a more refined overall appearance\n- a piece that feels worth holding onto because of its finish\n\nIf you are asking whether the price difference is worth it, the real test is this: will you notice and value the extra polish every time you wear it? If the answer is yes, saltwater pearls usually justify the difference.\n\n## A refined starting point if you prefer saltwater pearls\n\nFor readers who want a pearl with lasting luster and a more polished feel, saltwater pearls are often the clearer choice. They do not have to be the louder option to be the more satisfying one.\n\nIf you are exploring that direction, look for pieces that keep the focus on finish, wearability, and restraint. That is often where saltwater pearls feel most compelling."
}
