{
  "slug": "how-to-build-a-pearl-collection",
  "frontmatter": {
    "title": "How to Build a Pearl Collection",
    "excerpt": "Learn how to choose pearl types for a collection that feels cohesive, wearable, and aligned with your style, including South Sea, Akoya, and Tahitian pearls.",
    "seoDescription": "Learn how to build a pearl collection with confidence by comparing South Sea, Akoya, and Tahitian pearls in a practical buying guide.",
    "keywords": [
      "pearl collection",
      "South Sea pearls",
      "Akoya pearls",
      "Tahitian pearls",
      "pearl buying guide",
      "pearl quiz"
    ],
    "ogImage": "/images/og-home.png",
    "ogImageAlt": "Elegant pearl jewelry arranged in a clean editorial composition",
    "publishedAt": "2026-04-28",
    "updatedAt": "2026-04-28",
    "author": "33 Pearl Atelier",
    "tags": [
      "Pearl Buying Guide",
      "Pearl Types",
      "Necklaces",
      "Earrings",
      "Studs",
      "Rings"
    ],
    "readingMinutes": 5
  },
  "bodyMarkdown": "## Why building a pearl collection starts with the right question\n\nA pearl collection works best when it fits how you actually wear jewelry. Before choosing a piece, it helps to ask a simpler question: do you want something classic, something with more contrast, or a collection that can move between both?\n\nThat frame makes the decision easier. Instead of collecting pearls at random, you can build with intention—choosing pieces that feel cohesive, wearable, and true to your style.\n\n## The three pearl types that matter most here\n\nFor most collection-building decisions, three pearl types come up most often: white South Sea pearls, Akoya pearls, and Tahitian pearls. Each brings a different feeling to a collection, and that difference is what helps the pieces work together.\n\nWhite South Sea pearls tend to read as calm and refined. Akoya pearls are often associated with a more classic, polished look. Tahitian pearls bring a darker, more dramatic presence that can add contrast to a collection.\n\n## How each pearl type fits a different collection goal\n\nIf you want a collection that feels especially timeless, Akoya pearls are often the most straightforward place to start. They suit readers who want a clean, familiar pearl look that can work across everyday wear and more formal settings.\n\nIf you want something softer and more elevated in presence, white South Sea pearls can anchor a collection with a quieter sense of scale. They can be a strong choice for someone building around a few pieces that feel polished without needing extra detail.\n\nIf your collection should feel more distinctive or dimensional, Tahitian pearls offer that darker contrast. They can balance a collection that already includes lighter pearl pieces, or they can serve as the statement point in a smaller assortment.\n\nYou do not need every type to create a meaningful collection. In many cases, the right mix is less about owning more and more about choosing pearls that complement one another in tone and mood.\n\n## What to consider before choosing your first or next piece\n\nThe piece category matters as much as the pearl type. A necklace can set the tone of a collection, while earrings or studs may be the easiest way to wear pearls often. Rings can add a more personal, immediate kind of presence.\n\nIf you are building slowly, think about how each piece will live in your wardrobe. Do you want something that disappears into daily wear, or something that feels more occasion-driven? That answer usually narrows the choice faster than comparing pearl types in the abstract.\n\nFor a first piece, many readers start with the category they will reach for most often. For a next piece, it can help to choose the pearl type that adds a new note to what you already own.\n\n## Use the collection quiz if you want a faster starting point\n\nIf you are unsure where to begin, a collection quiz can help narrow the field. It is often easier to choose once you have a starting point that reflects your style and how you plan to wear the jewelry.\n\nThat kind of guidance is especially useful when you are deciding between a classic direction, a more refined look, or a piece with more contrast.\n\n## A simple way to begin your pearl collection\n\nA strong pearl collection does not need to be built all at once. Start with the type that best matches how you want to wear pearls now, then add pieces that expand the collection in a clear direction.\n\nIf you keep the focus on wearability, cohesion, and the role each pearl type plays, the choices become much simpler.",
  "internalLinks": [],
  "qa": {
    "primaryKeywordUsed": false,
    "relatedReadingSectionIncluded": false,
    "notes": []
  },
  "markdownDocument": "---\ntitle: \"How to Build a Pearl Collection\"\nexcerpt: \"Learn how to choose pearl types for a collection that feels cohesive, wearable, and aligned with your style, including South Sea, Akoya, and Tahitian pearls.\"\nseoDescription: \"Learn how to build a pearl collection with confidence by comparing South Sea, Akoya, and Tahitian pearls in a practical buying guide.\"\nkeywords: [\"pearl collection\", \"South Sea pearls\", \"Akoya pearls\", \"Tahitian pearls\", \"pearl buying guide\", \"pearl quiz\"]\nogImage: \"/images/og-home.png\"\nogImageAlt: \"Elegant pearl jewelry arranged in a clean editorial composition\"\npublishedAt: \"2026-04-28\"\nupdatedAt: \"2026-04-28\"\nauthor: \"33 Pearl Atelier\"\ntags: [\"Pearl Buying Guide\", \"Pearl Types\", \"Necklaces\", \"Earrings\", \"Studs\", \"Rings\"]\nreadingMinutes: 5\n---\n\n## Why building a pearl collection starts with the right question\n\nA pearl collection works best when it fits how you actually wear jewelry. Before choosing a piece, it helps to ask a simpler question: do you want something classic, something with more contrast, or a collection that can move between both?\n\nThat frame makes the decision easier. Instead of collecting pearls at random, you can build with intention—choosing pieces that feel cohesive, wearable, and true to your style.\n\n## The three pearl types that matter most here\n\nFor most collection-building decisions, three pearl types come up most often: white South Sea pearls, Akoya pearls, and Tahitian pearls. Each brings a different feeling to a collection, and that difference is what helps the pieces work together.\n\nWhite South Sea pearls tend to read as calm and refined. Akoya pearls are often associated with a more classic, polished look. Tahitian pearls bring a darker, more dramatic presence that can add contrast to a collection.\n\n## How each pearl type fits a different collection goal\n\nIf you want a collection that feels especially timeless, Akoya pearls are often the most straightforward place to start. They suit readers who want a clean, familiar pearl look that can work across everyday wear and more formal settings.\n\nIf you want something softer and more elevated in presence, white South Sea pearls can anchor a collection with a quieter sense of scale. They can be a strong choice for someone building around a few pieces that feel polished without needing extra detail.\n\nIf your collection should feel more distinctive or dimensional, Tahitian pearls offer that darker contrast. They can balance a collection that already includes lighter pearl pieces, or they can serve as the statement point in a smaller assortment.\n\nYou do not need every type to create a meaningful collection. In many cases, the right mix is less about owning more and more about choosing pearls that complement one another in tone and mood.\n\n## What to consider before choosing your first or next piece\n\nThe piece category matters as much as the pearl type. A necklace can set the tone of a collection, while earrings or studs may be the easiest way to wear pearls often. Rings can add a more personal, immediate kind of presence.\n\nIf you are building slowly, think about how each piece will live in your wardrobe. Do you want something that disappears into daily wear, or something that feels more occasion-driven? That answer usually narrows the choice faster than comparing pearl types in the abstract.\n\nFor a first piece, many readers start with the category they will reach for most often. For a next piece, it can help to choose the pearl type that adds a new note to what you already own.\n\n## Use the collection quiz if you want a faster starting point\n\nIf you are unsure where to begin, a collection quiz can help narrow the field. It is often easier to choose once you have a starting point that reflects your style and how you plan to wear the jewelry.\n\nThat kind of guidance is especially useful when you are deciding between a classic direction, a more refined look, or a piece with more contrast.\n\n## A simple way to begin your pearl collection\n\nA strong pearl collection does not need to be built all at once. Start with the type that best matches how you want to wear pearls now, then add pieces that expand the collection in a clear direction.\n\nIf you keep the focus on wearability, cohesion, and the role each pearl type plays, the choices become much simpler."
}
